<Schema name="Tutorial" metamodelVersion='3.0' xsi:noNamespaceSchemaLocation="mondrian3.xsd" xmlns:xsi="http://www.w3.org/2001/XMLSchema-instance"> 
 
<!-- Level attribute description:
    
    * General *
    - name:
    - table (optional):
    - visible (optional):

    * Member Specific *
    - column: key column
    - type: data type of the value column
    - nameColumn (optional): internally used name, e.g. for MDX query
    - captionColumn (optional): value presented to end user 
    - ordinalColumn (optional): the column which specifies the order of the members
    - uniqueMembers 
    
    * Level Specific *
    - caption (optional): A string being displayed instead of the level's name. Can be localized from Properties file using #{propertyname}.
    - description (optional): Description of this level. Can be localized from Properties file using #{propertyname}.
    - levelType: Whether this is a regular or a time-related level
                             
 -->
    <Dimension name="Date" type="TimeDimension" visible="true" highCardinality="false">
        <Hierarchy name="Date" visible="true" hasAll="true" allMemberName="Total" allMemberCaption="Total" primaryKey="date_tk">
            <Table name="dim_date" schema="tutorial"/>
            <Level 
                name="Date" 
                column="date" 
                type="Date" 
                uniqueMembers="true" 
                levelType="TimeDays" 
                hideMemberIf="Never" 
                visible="true">
                <Annotations>
                    <Annotation name="AnalyzerDateFormat">
                    <![CDATA[[yyyy-MM-dd]]]>
                    </Annotation>
                </Annotations>
            </Level>
        </Hierarchy> 
        <Hierarchy name="Monthly Calendar" caption="Monthly Calendar" visible="true" hasAll="true" allMemberName="Total" allMemberCaption="Total" primaryKey="date_tk">
            <Table name="dim_date" schema="tutorial"/>
            <Level 
                name="Year" 
                column="year" 
                type="Integer" 
                uniqueMembers="false" 
                levelType="TimeYears" 
                hideMemberIf="Never" 
                visible="true" 
            >
                <Annotations>
                    <Annotation name="AnalyzerDateFormat">
                      <![CDATA[[yyyy]]]>
                    </Annotation>
                </Annotations>
            </Level>
            <!-- Note: 
                We can achieve two different sets of behaviours here:
                1) If the user doesn't use the parent year in the analysis, the quarter is displayed as 4 distinct values
                  , repeated over and over again without showing the context of the parent: 
                    - in this case define only quarter as the key column
                2) The quarter is displayed in relation to the year: 
                    - in this case define year and quarter as key column
                Below the second option is implemented.
            -->    
            <Level 
                name="Quarter" 
                column="year_quarter"
                type="Integer"  
                nameColumn="quarter"
                captionColumn="year_quarter_label"
                ordinalColumn="year_quarter"  
                uniqueMembers="false" 
                levelType="TimeQuarters" 
                hideMemberIf="Never" 
                visible="true" 
            >
                <Annotations>
                    <Annotation name="AnalyzerDateFormat">
                    <![CDATA[[yyyy].[Q]]]>
                    </Annotation>
                </Annotations>
            </Level>
            <Level 
                name="Month" 
                column="year_month"
                type="Integer" 
                nameColumn="month" 
                captionColumn="year_month_label"
                ordinalColumn="year_month" 
                uniqueMembers="false" 
                levelType="TimeMonths" 
                hideMemberIf="Never" 
                visible="true" 
            >
                <Annotations>
                    <Annotation name="AnalyzerDateFormat">
                    <![CDATA[[yyyy].[Q].[M]]]>
                    </Annotation>
                </Annotations>
            </Level>
            <Level 
                name="Day of the Month" 
                column="date_tk" 
                type="Integer" 
                nameColumn="day_of_month"
                captionColumn="day_of_month" 
                ordinalColumn="date_tk" 
                uniqueMembers="true" 
                levelType="TimeDays"
                hideMemberIf="Never" 
                visible="true" 
            >
                <Annotations>
                    <Annotation name="AnalyzerDateFormat">
                    <![CDATA[[yyyy].[Q].[M].[d]]]>
                    </Annotation>
                </Annotations>
            </Level>
        </Hierarchy>	
        <Hierarchy name="Weekly Calendar" caption="Weekly Calendar" visible="true" hasAll="true" allMemberName="Total" allMemberCaption="Total" primaryKey="date_tk">
            <Table name="dim_date" schema="tutorial"/>
            <Level 
                name="Year" 
                column="iso8601_year" 
                type="Integer" 
                uniqueMembers="false" 
                levelType="TimeYears" 
                hideMemberIf="Never" 
                visible="true" 
            >
                <Annotations>
                    <Annotation name="AnalyzerDateFormat">
                    <![CDATA[[YYYY]]]>
                    </Annotation>
                </Annotations>
            </Level>
            <Level 
                name="Week" 
                column="iso8601_year_week" 
                type="Integer" 
                nameColumn="iso8601_week"
                captionColumn="iso8601_year_week_label"  
                ordinalColumn="iso8601_year_week" 
                uniqueMembers="false" 
                levelType="TimeWeeks" 
                hideMemberIf="Never" 
                visible="true" 
            >
                <Annotations>
                    <Annotation name="AnalyzerDateFormat">
                    <![CDATA[[YYYY].[w]]]>
                    </Annotation>
                </Annotations>
            </Level>
            <Level 
                name="Day of the Week" 
                column="date_tk" 
                type="Integer" 
                nameColumn="iso8601_day_of_week" 
                captionColumn="iso8601_day_of_week"
                ordinalColumn="date_tk" 
                uniqueMembers="true" 
                levelType="TimeDays" 
                hideMemberIf="Never" 
                visible="true" 
            >
                <Property name="Label" column="dow_label" type="String"/>
                <Annotations>
                    <Annotation name="AnalyzerDateFormat">
                    <![CDATA[[yyyy].[w].[e]]]>
                    </Annotation>
                </Annotations>
            </Level>
        </Hierarchy>       
    </Dimension>
    <Dimension name="Date Alt" type="TimeDimension" visible="true" highCardinality="false">
        <Hierarchy name="Date" visible="true" hasAll="true" allMemberName="Total" allMemberCaption="Total" primaryKey="date_tk">
            <Table name="dim_date" schema="tutorial"/>
            <Level 
                name="Date" 
                column="date" 
                type="Date" 
                uniqueMembers="true" 
                levelType="TimeDays" 
                hideMemberIf="Never" 
                visible="true">
                <Annotations>
                    <Annotation name="AnalyzerDateFormat">
                    <![CDATA[[yyyy-MM-dd]]]>
                    </Annotation>
                </Annotations>
            </Level>
        </Hierarchy> 
        <Hierarchy name="Monthly Calendar" caption="Monthly Calendar" visible="true" hasAll="true" allMemberName="Total" allMemberCaption="Total" primaryKey="date_tk">
            <Table name="dim_date" schema="tutorial"/>
            <Level 
                name="Year" 
                column="year" 
                type="Integer" 
                uniqueMembers="false" 
                levelType="TimeYears" 
                hideMemberIf="Never" 
                visible="true" 
            >
                <Annotations>
                    <Annotation name="AnalyzerDateFormat">
                      <![CDATA[[yyyy]]]>
                    </Annotation>
                </Annotations>
            </Level>
            <!-- Note: 
                We can achieve two different sets of behaviours here:
                1) If the user doesn't use the parent year in the analysis, the quarter is displayed as 4 distinct values
                    , which get repeated over and over again, so it is difficult to understand to which year the values belong e.g: 
                    - in this case define only quarter as the key column
                2) The quarter is displayed in relation to the year: 
                    - in this case define year and quarter as key column
                Below the second option is implemented.
            -->    
            <Level 
                name="Quarter" 
                column="quarter"
                type="Integer" 
                uniqueMembers="false" 
                levelType="TimeQuarters" 
                hideMemberIf="Never" 
                visible="true" 
            >
                <Annotations>
                    <Annotation name="AnalyzerDateFormat">
                    <![CDATA[[yyyy].[Q]]]>
                    </Annotation>
                </Annotations>
            </Level>
            <Level 
                name="Month" 
                column="month"
                type="Integer" 
                uniqueMembers="false" 
                levelType="TimeMonths"